{
  "$schema": "http://json-schema.org/draft-07/schema#",
  "title": "grammy_creators_db.songwriters_composers",
  "description": "Formal MongoDB schema for songwriters_composers collection in grammy_creators_db",
  "type": "object",
  "required": [
    "songwriter_id",
    "creator_id",
    "pro_affiliation",
    "ipi_cae_identifier",
    "music_publisher_company",
    "lyric_vs_composition_focus",
    "registered_works_count",
    "inducted_songwriters_hof",
    "primary_songwriting_instrument",
    "signature_melodic_style"
  ],
  "properties": {
    "songwriter_id": {
      "type": "string",
      "description": "Domain attribute: songwriter_id"
    },
    "creator_id": {
      "type": "string",
      "description": "Domain attribute: creator_id"
    },
    "pro_affiliation": {
      "type": "string",
      "description": "Domain attribute: pro_affiliation"
    },
    "ipi_cae_identifier": {
      "type": "string",
      "description": "Domain attribute: ipi_cae_identifier"
    },
    "music_publisher_company": {
      "type": "string",
      "description": "Domain attribute: music_publisher_company"
    },
    "lyric_vs_composition_focus": {
      "type": "string",
      "description": "Domain attribute: lyric_vs_composition_focus"
    },
    "registered_works_count": {
      "type": "integer",
      "description": "Domain attribute: registered_works_count"
    },
    "inducted_songwriters_hof": {
      "type": "boolean",
      "description": "Domain attribute: inducted_songwriters_hof"
    },
    "primary_songwriting_instrument": {
      "type": "string",
      "description": "Domain attribute: primary_songwriting_instrument"
    },
    "signature_melodic_style": {
      "type": "string",
      "description": "Domain attribute: signature_melodic_style"
    }
  },
  "additionalProperties": true
}