[
  {
    "songwriter_id": "SONG_001",
    "creator_id": "CRT_NEL_BLU_DIPINTO_DI_BLU_VOLARE_0000",
    "pro_affiliation": "ASCAP",
    "ipi_cae_identifier": "IPI-0500000",
    "music_publisher_company": "Sony Music Publishing / Universal Music Publishing",
    "lyric_vs_composition_focus": "Both Lyrics and Melodic Composition",
    "registered_works_count": 120,
    "inducted_songwriters_hof": true,
    "primary_songwriting_instrument": "Piano and Acoustic Guitar",
    "signature_melodic_style": "Anthemic chord progressions and evocative lyrical imagery"
  },
  {
    "songwriter_id": "SONG_002",
    "creator_id": "CRT_HENRY_MANCINI_0001",
    "pro_affiliation": "BMI",
    "ipi_cae_identifier": "IPI-0500001",
    "music_publisher_company": "Sony Music Publishing / Universal Music Publishing",
    "lyric_vs_composition_focus": "Both Lyrics and Melodic Composition",
    "registered_works_count": 130,
    "inducted_songwriters_hof": false,
    "primary_songwriting_instrument": "Piano and Acoustic Guitar",
    "signature_melodic_style": "Anthemic chord progressions and evocative lyrical imagery"
  },
  {
    "songwriter_id": "SONG_003",
    "creator_id": "CRT_ELLA_FITZGERALD_0002",
    "pro_affiliation": "ASCAP",
    "ipi_cae_identifier": "IPI-0500002",
    "music_publisher_company": "Sony Music Publishing / Universal Music Publishing",
    "lyric_vs_composition_focus": "Both Lyrics and Melodic Composition",
    "registered_works_count": 140,
    "inducted_songwriters_hof": false,
    "primary_songwriting_instrument": "Piano and Acoustic Guitar",
    "signature_melodic_style": "Anthemic chord progressions and evocative lyrical imagery"
  },
  {
    "songwriter_id": "SONG_004",
    "creator_id": "CRT_CATCH_A_FALLING_STAR_0003",
    "pro_affiliation": "BMI",
    "ipi_cae_identifier": "IPI-0500003",
    "music_publisher_company": "Sony Music Publishing / Universal Music Publishing",
    "lyric_vs_composition_focus": "Both Lyrics and Melodic Composition",
    "registered_works_count": 150,
    "inducted_songwriters_hof": false,
    "primary_songwriting_instrument": "Piano and Acoustic Guitar",
    "signature_melodic_style": "Anthemic chord progressions and evocative lyrical imagery"
  },
  {
    "songwriter_id": "SONG_005",
    "creator_id": "CRT_BILLY_MAY_S_BIG_FAT_BRASS_0004",
    "pro_affiliation": "ASCAP",
    "ipi_cae_identifier": "IPI-0500004",
    "music_publisher_company": "Sony Music Publishing / Universal Music Publishing",
    "lyric_vs_composition_focus": "Both Lyrics and Melodic Composition",
    "registered_works_count": 160,
    "inducted_songwriters_hof": false,
    "primary_songwriting_instrument": "Piano and Acoustic Guitar",
    "signature_melodic_style": "Anthemic chord progressions and evocative lyrical imagery"
  },
  {
    "songwriter_id": "SONG_006",
    "creator_id": "CRT_BASIE_0005",
    "pro_affiliation": "BMI",
    "ipi_cae_identifier": "IPI-0500005",
    "music_publisher_company": "Sony Music Publishing / Universal Music Publishing",
    "lyric_vs_composition_focus": "Both Lyrics and Melodic Composition",
    "registered_works_count": 170,
    "inducted_songwriters_hof": true,
    "primary_songwriting_instrument": "Piano and Acoustic Guitar",
    "signature_melodic_style": "Anthemic chord progressions and evocative lyrical imagery"
  },
  {
    "songwriter_id": "SONG_007",
    "creator_id": "CRT_THAT_OLD_BLACK_MAGIC_0006",
    "pro_affiliation": "ASCAP",
    "ipi_cae_identifier": "IPI-0500006",
    "music_publisher_company": "Sony Music Publishing / Universal Music Publishing",
    "lyric_vs_composition_focus": "Both Lyrics and Melodic Composition",
    "registered_works_count": 180,
    "inducted_songwriters_hof": false,
    "primary_songwriting_instrument": "Piano and Acoustic Guitar",
    "signature_melodic_style": "Anthemic chord progressions and evocative lyrical imagery"
  },
  {
    "songwriter_id": "SONG_008",
    "creator_id": "CRT_THE_CHIPMUNK_SONG_0007",
    "pro_affiliation": "BMI",
    "ipi_cae_identifier": "IPI-0500007",
    "music_publisher_company": "Sony Music Publishing / Universal Music Publishing",
    "lyric_vs_composition_focus": "Both Lyrics and Melodic Composition",
    "registered_works_count": 190,
    "inducted_songwriters_hof": false,
    "primary_songwriting_instrument": "Piano and Acoustic Guitar",
    "signature_melodic_style": "Anthemic chord progressions and evocative lyrical imagery"
  },
  {
    "songwriter_id": "SONG_009",
    "creator_id": "CRT_TOM_DOOLEY_0008",
    "pro_affiliation": "ASCAP",
    "ipi_cae_identifier": "IPI-0500008",
    "music_publisher_company": "Sony Music Publishing / Universal Music Publishing",
    "lyric_vs_composition_focus": "Both Lyrics and Melodic Composition",
    "registered_works_count": 200,
    "inducted_songwriters_hof": false,
    "primary_songwriting_instrument": "Piano and Acoustic Guitar",
    "signature_melodic_style": "Anthemic chord progressions and evocative lyrical imagery"
  },
  {
    "songwriter_id": "SONG_010",
    "creator_id": "CRT_TEQUILA_0009",
    "pro_affiliation": "BMI",
    "ipi_cae_identifier": "IPI-0500009",
    "music_publisher_company": "Sony Music Publishing / Universal Music Publishing",
    "lyric_vs_composition_focus": "Both Lyrics and Melodic Composition",
    "registered_works_count": 210,
    "inducted_songwriters_hof": false,
    "primary_songwriting_instrument": "Piano and Acoustic Guitar",
    "signature_melodic_style": "Anthemic chord progressions and evocative lyrical imagery"
  },
  {
    "songwriter_id": "SONG_011",
    "creator_id": "CRT_DUETS_WITH_A_SPANISH_GUITAR_0010",
    "pro_affiliation": "ASCAP",
    "ipi_cae_identifier": "IPI-0500010",
    "music_publisher_company": "Sony Music Publishing / Universal Music Publishing",
    "lyric_vs_composition_focus": "Both Lyrics and Melodic Composition",
    "registered_works_count": 220,
    "inducted_songwriters_hof": true,
    "primary_songwriting_instrument": "Piano and Acoustic Guitar",
    "signature_melodic_style": "Anthemic chord progressions and evocative lyrical imagery"
  },
  {
    "songwriter_id": "SONG_012",
    "creator_id": "CRT_FRANK_SINATRA_0011",
    "pro_affiliation": "BMI",
    "ipi_cae_identifier": "IPI-0500011",
    "music_publisher_company": "Sony Music Publishing / Universal Music Publishing",
    "lyric_vs_composition_focus": "Both Lyrics and Melodic Composition",
    "registered_works_count": 230,
    "inducted_songwriters_hof": false,
    "primary_songwriting_instrument": "Piano and Acoustic Guitar",
    "signature_melodic_style": "Anthemic chord progressions and evocative lyrical imagery"
  },
  {
    "songwriter_id": "SONG_013",
    "creator_id": "CRT_CROSS_COUNTRY_SUITE_0012",
    "pro_affiliation": "ASCAP",
    "ipi_cae_identifier": "IPI-0500012",
    "music_publisher_company": "Sony Music Publishing / Universal Music Publishing",
    "lyric_vs_composition_focus": "Both Lyrics and Melodic Composition",
    "registered_works_count": 240,
    "inducted_songwriters_hof": false,
    "primary_songwriting_instrument": "Piano and Acoustic Guitar",
    "signature_melodic_style": "Anthemic chord progressions and evocative lyrical imagery"
  },
  {
    "songwriter_id": "SONG_014",
    "creator_id": "CRT_THE_MUSIC_MAN_0013",
    "pro_affiliation": "BMI",
    "ipi_cae_identifier": "IPI-0500013",
    "music_publisher_company": "Sony Music Publishing / Universal Music Publishing",
    "lyric_vs_composition_focus": "Both Lyrics and Melodic Composition",
    "registered_works_count": 250,
    "inducted_songwriters_hof": false,
    "primary_songwriting_instrument": "Piano and Acoustic Guitar",
    "signature_melodic_style": "Anthemic chord progressions and evocative lyrical imagery"
  },
  {
    "songwriter_id": "SONG_015",
    "creator_id": "CRT_ANDR_PREVIN_0014",
    "pro_affiliation": "ASCAP",
    "ipi_cae_identifier": "IPI-0500014",
    "music_publisher_company": "Sony Music Publishing / Universal Music Publishing",
    "lyric_vs_composition_focus": "Both Lyrics and Melodic Composition",
    "registered_works_count": 260,
    "inducted_songwriters_hof": false,
    "primary_songwriting_instrument": "Piano and Acoustic Guitar",
    "signature_melodic_style": "Anthemic chord progressions and evocative lyrical imagery"
  },
  {
    "songwriter_id": "SONG_016",
    "creator_id": "CRT_THE_BEST_OF_THE_STAN_FREBERG_S_0015",
    "pro_affiliation": "BMI",
    "ipi_cae_identifier": "IPI-0500015",
    "music_publisher_company": "Sony Music Publishing / Universal Music Publishing",
    "lyric_vs_composition_focus": "Both Lyrics and Melodic Composition",
    "registered_works_count": 270,
    "inducted_songwriters_hof": true,
    "primary_songwriting_instrument": "Piano and Acoustic Guitar",
    "signature_melodic_style": "Anthemic chord progressions and evocative lyrical imagery"
  },
  {
    "songwriter_id": "SONG_017",
    "creator_id": "CRT_GAIETE_PARISIENNE_0016",
    "pro_affiliation": "ASCAP",
    "ipi_cae_identifier": "IPI-0500016",
    "music_publisher_company": "Sony Music Publishing / Universal Music Publishing",
    "lyric_vs_composition_focus": "Both Lyrics and Melodic Composition",
    "registered_works_count": 280,
    "inducted_songwriters_hof": false,
    "primary_songwriting_instrument": "Piano and Acoustic Guitar",
    "signature_melodic_style": "Anthemic chord progressions and evocative lyrical imagery"
  },
  {
    "songwriter_id": "SONG_018",
    "creator_id": "CRT_TCHAIKOVSKY_PIANO_CONCERTO_NO__0017",
    "pro_affiliation": "BMI",
    "ipi_cae_identifier": "IPI-0500017",
    "music_publisher_company": "Sony Music Publishing / Universal Music Publishing",
    "lyric_vs_composition_focus": "Both Lyrics and Melodic Composition",
    "registered_works_count": 290,
    "inducted_songwriters_hof": false,
    "primary_songwriting_instrument": "Piano and Acoustic Guitar",
    "signature_melodic_style": "Anthemic chord progressions and evocative lyrical imagery"
  },
  {
    "songwriter_id": "SONG_019",